1,es_ES,Q01,"Cuáles cree usted que son las horas más productivas de su jornada laboral?",1,"""Q01"": ""Cuáles cree usted que son las horas más productivas de su jornada laboral?"""
2,es_ES,Q02,"Por qué?",2,"""Q02"": ""Por qué?"""
3,es_ES,Q03,"Qué tiempo aproximado dedica diariamente a organizar documentos, expedientes y su agenda?",3,"""Q03"": ""Qué tiempo aproximado dedica diariamente a organizar documentos, expedientes y su agenda?"""
4,es_ES,Q04,"Gestiona usted mismo su agenda o hay alguien que lo hace por usted?",4,"""Q04"": ""Gestiona usted mismo su agenda o hay alguien que lo hace por usted?"""
5,es_ES,Q05,"Utiliza o ha utilizado alguna herramienta informática que le ayude a gestionar su tiempo?",5,"""Q05"": ""Utiliza o ha utilizado alguna herramienta informática que le ayude a gestionar su tiempo?"""
6,es_ES,Q06,"Qué aspecto de su trabajo considera que puede mejorar?",6,"""Q06"": ""Qué aspecto de su trabajo considera que puede mejorar?"""
7,es_ES,Q07,"De qué forma suele facturar su trabajo (por tiempo, por tramos, por asuntos, etc)",7,"""Q07"": ""De qué forma suele facturar su trabajo (por tiempo, por tramos, por asuntos, etc)"""
8,es_ES,Q08,"Tiene usted control efectivo del tiempo/dinero que invierte en cada cliente?",8,"""Q08"": ""Tiene usted control efectivo del tiempo/dinero que invierte en cada cliente?"""
9,es_ES,Q09,"Cuántos abogados trabajan en su mismo despacho?",9,"""Q09"": ""Cuántos abogados trabajan en su mismo despacho?"""
